{
  "$schema": "https://swornagent.dev/schemas/replacement-closure-dispatch-receipt-v1.json",
  "record_version": 1,
  "release": "2026-07-15-baton-v0.16-conformance",
  "slice_id": "S02-v015-parity-and-installs",
  "start_commit": "e61cb190736ee7483fb4ed1a993442b26ce3574c",
  "review_head": "2a17443d67d39cf681dba117a57673714a916d7f",
  "claim_path": "docs/release/2026-07-15-baton-v0.16-conformance/S02-v015-parity-and-installs/replacement-closure-claim.json",
  "claim_commit": "9896756ca118eef46662fba465e95f6ba6adbdb9",
  "invocation_id": "1329db03-1597-45a1-a6de-2c778325af62",
  "continuity_token": "cc3a5cfad3e72cdda9368fe6f9fa9a8aa043e98d0e1b640e7a29bed6a85914b5",
  "report_path": "docs/release/2026-07-15-baton-v0.16-conformance/S02-v015-parity-and-installs/reports/maintainability/implementer-cycle-0-1329db03-1597-45a1-a6de-2c778325af62.json",
  "report_blob_oid": "7aadead414b8f04674f2bce5b0966c657922e370",
  "verdict": "PASS",
  "authorization_manifest_sha256": "sha256:3d0e0da7fa57a0d754b8e0b6a0faae90f47bea72c100ea2dbf0ba4c68c486dc1",
  "authorization_schema_sha256": "sha256:daa13bd5cb8dd3d5c0f7473ee132b9d15d083405a1e89bfeedc7f8e298bbbbad",
  "claim_schema_sha256": "sha256:32023df8e953640b266d9113c9055b9cd601cceb26e842def080dc1491563746",
  "receipt_schema_sha256": "sha256:3678f1ac208e0d9a04a3bc01ad9d9e61fa8bc5472402a05ae376f21ca8022a52",
  "state": "response-received"
}
